{
  "schema_version": "1.0.0",
  "repository": "https://github.com/SonSangjoon/coffee-chat",
  "version": "2026.08.04",
  "source_ref": "refs/tags/v2026.08.04",
  "target_manifest_schema_version": "1.1.0",
  "migration_registry": {
    "path": "./engine/migrations/registry.json",
    "digest": "sha256:92d08686a73e43e1c842a739f2f6d0018fca5995c12a6d55f5f597b31c4954c3"
  },
  "managed_files": [
    {
      "path": "./.editorconfig",
      "digest": "sha256:a6b98ea7cb6d61ed8d430dd0dffa46c87012b5cf859d4ce7207898954951fdcd",
      "mode": "100644",
      "class": "engine-source"
    },
    {
      "path": "./.gitattributes",
      "digest": "sha256:8a0f8488eb7c7da84260209230d7982c1f80d4c8745b84ccbe97c247df24c0a6",
      "mode": "100644",
      "class": "engine-source"
    },
    {
      "path": "./.github/merge-policy.json",
      "digest": "sha256:e88edea4674fbfe6f983d3702c5b5ad1313de3c261f59ba5b354b27fe57ebb44",
      "mode": "100644",
      "class": "engine-source"
    },
    {
      "path": "./.github/workflows/auto-merge.yml",
      "digest": "sha256:80bd4059c93927209422499001dbc682fd7a6a5c76108d06a400299ea75efe79",
      "mode": "100644",
      "class": "engine-source"
    },
    {
      "path": "./.github/workflows/ci.yml",
      "digest": "sha256:b763e1db1bdb880d0f82d605e9ff8df432be6440de8f73cbc0a417b88eeda13a",
      "mode": "100644",
      "class": "engine-source"
    },
    {
      "path": "./.github/workflows/security.yml",
      "digest": "sha256:761019032ba26474d8afec0857036889118763e298e424b19ddd5db93c507a35",
      "mode": "100644",
      "class": "engine-source"
    },
    {
      "path": "./.gitignore",
      "digest": "sha256:8c1a0bf3df5030eb6d06659284c18b722a3bc3581ee5954730f0d2d7e42190fa",
      "mode": "100644",
      "class": "engine-source"
    },
    {
      "path": "./.gitleaks.toml",
      "digest": "sha256:4cb73cbd6e7a30e9a4a4d793ff7cb29d31063345e6917f32bfb3f6cbe614b48d",
      "mode": "100644",
      "class": "engine-source"
    },
    {
      "path": "./.node-version",
      "digest": "sha256:0667c9be2ca8fad9083f936776a81b73fb1c81e32f30cb4da5460f470a09f1c7",
      "mode": "100644",
      "class": "engine-source"
    },
    {
      "path": "./.pre-commit-config.yaml",
      "digest": "sha256:2b5ea92fa21097814724f5e3f3c94dfef6188900be2ef385a2c034ee935941ed",
      "mode": "100644",
      "class": "engine-source"
    },
    {
      "path": "./.prettierignore",
      "digest": "sha256:aa55697893fb2a053cd00aa9024e38ff8668659d220dbefc43b78a8e61bb21c2",
      "mode": "100644",
      "class": "engine-source"
    },
    {
      "path": "./LICENSE",
      "digest": "sha256:4e877a766f8f5ea05b55cd7447e272c9307e892014c573704a4b9f2c7146a0c0",
      "mode": "100644",
      "class": "engine-source"
    },
    {
      "path": "./astro.config.mjs",
      "digest": "sha256:6756d1518872b9a170b8585a0033e103c54a81860517812ac1ba8d64344c05ec",
      "mode": "100644",
      "class": "engine-source"
    },
    {
      "path": "./docs/assets/readme/coffee-chat-agent.en.png",
      "digest": "sha256:18b746128a84f2b4eae98662e6fde796a0ecabac27c7d3b8316093b3243c8f5e",
      "mode": "100644",
      "class": "engine-source"
    },
    {
      "path": "./docs/assets/readme/coffee-chat-cover.png",
      "digest": "sha256:88cf9c695c7793ef1a2ef28a1ad528c5b40ec4c6aed7e53495211d1a36ad48d9",
      "mode": "100644",
      "class": "engine-source"
    },
    {
      "path": "./docs/assets/readme/coffee-chat-taste.en.png",
      "digest": "sha256:d10069500923088a4f72910c6f3599da1253caffe67d6e14597fc67956476de3",
      "mode": "100644",
      "class": "engine-source"
    },
    {
      "path": "./docs/design/coffee-chat.md",
      "digest": "sha256:daf2596261c8948c1856a2b02692b25b7a34309c8e72bb2c436af3afa8c557da",
      "mode": "100644",
      "class": "engine-source"
    },
    {
      "path": "./method/shared-method.md",
      "digest": "sha256:f54687c3aa5205d76b3eeb8448cdf1e230f61baf4ce1d5c5086b2e33337a35d5",
      "mode": "100644",
      "class": "engine-source"
    },
    {
      "path": "./package-lock.json",
      "digest": "sha256:ff15527403b411a111f289b02e2dc8fa569e9d37c3988dceb5de57939e1d6e60",
      "mode": "100644",
      "class": "engine-source"
    },
    {
      "path": "./package.json",
      "digest": "sha256:af0f11fe8f76eeba73fd812dec5f586c144c0439091b0e774de20bd44fc41305",
      "mode": "100644",
      "class": "engine-source"
    },
    {
      "path": "./playwright.config.ts",
      "digest": "sha256:d45b65c5e38a604e89c8623e826a2f2ce3310f5d45c5b53fab10656ec13c2e30",
      "mode": "100644",
      "class": "engine-source"
    },
    {
      "path": "./schemas/candidate-manifest.schema.json",
      "digest": "sha256:146cf66daf675f5caf8f4afcb200ffcb9dfe91f2d4bd06b5c8bfd22c5ebe5a68",
      "mode": "100644",
      "class": "engine-source"
    },
    {
      "path": "./schemas/candidate-request.schema.json",
      "digest": "sha256:6ded87ba4090e61dff059f41b111a4091ba4d78000954ac7a11646c55963d5df",
      "mode": "100644",
      "class": "engine-source"
    },
    {
      "path": "./schemas/coffee-chat-init-preview.schema.json",
      "digest": "sha256:4d20d93b1e1752b1c12f04acc7323d3667295d82d0ad1ce613d77a0743a2546d",
      "mode": "100644",
      "class": "engine-source"
    },
    {
      "path": "./schemas/coffee-chat-init-receipt.schema.json",
      "digest": "sha256:7a6871e1423a170d6e0eff16a8795617505c27c31564325d739b6404de0e120a",
      "mode": "100644",
      "class": "engine-source"
    },
    {
      "path": "./schemas/coffee-chat-sync-preview.schema.json",
      "digest": "sha256:c68d3ae8fa61d87d5f27547c85e3b7a2a8614cbb0c4a4a7119b0868eb0d1bab2",
      "mode": "100644",
      "class": "engine-source"
    },
    {
      "path": "./schemas/coffee-chat-sync-receipt.schema.json",
      "digest": "sha256:7211d6c2318141c6f66b3fb612643ec0d9951a3286111b791096c7f5f4ef582b",
      "mode": "100644",
      "class": "engine-source"
    },
    {
      "path": "./schemas/coffee-chat.schema.json",
      "digest": "sha256:cb2527034ed46ebd3483cd703976a96db56b8c480b90ea7a51e98f734892e0f4",
      "mode": "100644",
      "class": "engine-source"
    },
    {
      "path": "./schemas/engine-lock.schema.json",
      "digest": "sha256:13b1bac6697f6d511461904369a9887ecabab6c0a28c538ddf580c451bf025bb",
      "mode": "100644",
      "class": "engine-source"
    },
    {
      "path": "./schemas/entity-registry.schema.json",
      "digest": "sha256:de3e04fc7c8678e099a43b44b2fd91244655c94daeb94c509df737d4fd1e1430",
      "mode": "100644",
      "class": "engine-source"
    },
    {
      "path": "./schemas/generated-ownership.schema.json",
      "digest": "sha256:0c0a1d83144e0530bd87f3deeb0658bab36310a3232ed332bac8f06a0c4af90e",
      "mode": "100644",
      "class": "engine-source"
    },
    {
      "path": "./schemas/knowledge-index.schema.json",
      "digest": "sha256:a2e3407389b69809014adfb476422e0ffa126668d4e73af1ece9cd426526e77b",
      "mode": "100644",
      "class": "engine-source"
    },
    {
      "path": "./schemas/note-frontmatter.schema.json",
      "digest": "sha256:2625547284873f8d53e335f1246e00c8828906987177f85b36224696d6ccd6e2",
      "mode": "100644",
      "class": "engine-source"
    },
    {
      "path": "./schemas/operation-preview.schema.json",
      "digest": "sha256:e038971e5331ea8ac018cfa56481e9d50794acdbfc267f8cd06d56da0484b72f",
      "mode": "100644",
      "class": "engine-source"
    },
    {
      "path": "./schemas/operation-receipt.schema.json",
      "digest": "sha256:430c83e09fa8020d38930917e0ffb6ce33982adbf55219b0580357d2ae6432ba",
      "mode": "100644",
      "class": "engine-source"
    },
    {
      "path": "./schemas/preview.schema.json",
      "digest": "sha256:bb57c0d1d70cb5341111a8867f49ba9f7503fd4be7546ce0dff6befe4a68e72e",
      "mode": "100644",
      "class": "engine-source"
    },
    {
      "path": "./schemas/receipt.schema.json",
      "digest": "sha256:1cf408d3b0fbba2933dc15df983aad4aad9a6de9092391e0acd1e939e162457b",
      "mode": "100644",
      "class": "engine-source"
    },
    {
      "path": "./site/components/GraphView.astro",
      "digest": "sha256:2df86d3cd119fc8cced9301ff92fab1fe5f3a847424c9ab458a616b02d409a1c",
      "mode": "100644",
      "class": "engine-source"
    },
    {
      "path": "./site/components/KnowledgeList.astro",
      "digest": "sha256:1cfbd32f18b03a1ace6d62e43b435ca8c819c14e5fc29b0e3c072ec5b3153190",
      "mode": "100644",
      "class": "engine-source"
    },
    {
      "path": "./site/components/TemporalFilters.astro",
      "digest": "sha256:3095b3c3285ca47f4bbe3931bab60e637fdbd5e3e7f0b026425cce52e6fa2d6c",
      "mode": "100644",
      "class": "engine-source"
    },
    {
      "path": "./site/env.d.ts",
      "digest": "sha256:22ae54e67c4db7cdcf5d3893033581482486f25f0c0479f0bcddf87746dadd87",
      "mode": "100644",
      "class": "engine-source"
    },
    {
      "path": "./site/layouts/BaseLayout.astro",
      "digest": "sha256:d00c0c7850a5038a8aae61705baa2a73fd0db3741f2ffcd97caa2a43f82a0dda",
      "mode": "100644",
      "class": "engine-source"
    },
    {
      "path": "./site/lib/build-context.ts",
      "digest": "sha256:77531f02663cd4aa588e6aefd8507be0745d4f3cef6112a48b7c34d873a09edd",
      "mode": "100644",
      "class": "engine-source"
    },
    {
      "path": "./site/lib/load-site-model.ts",
      "digest": "sha256:9f5c73b7d12410df3579aa7136d555a6ef6367c9143c7429855e8075def350da",
      "mode": "100644",
      "class": "engine-source"
    },
    {
      "path": "./site/lib/render-markdown.ts",
      "digest": "sha256:fbaa6c0955a03b45151b8de71901ec5e7e3ee69e22f168432f76dfa567a141f5",
      "mode": "100644",
      "class": "engine-source"
    },
    {
      "path": "./site/lib/site-context.ts",
      "digest": "sha256:4985442803264313912fed3fc92534cd2ee916d9a0786b1aa6be1b8eaf7d69fd",
      "mode": "100644",
      "class": "engine-source"
    },
    {
      "path": "./site/lib/view.ts",